{
  "$schema": "../../meta/schemas/core/relationship.schema.json",
  "id": "passage_from_topology",
  "name": "Passage from Topology",
  "description": "Passages reference topology passages by pid. Each passage's topology_passage_ref field holds a passage pid that should exist in the parent topology. Runtime validates pid existence through custom checks, not relationship matching (array element matching not supported by relationship schema).",
  "from_type": "topology",
  "to_type": "passage",
  "kind": "references",
  "link_field": "topology_passage_ref"
}
